{
  "version": "0.2",
  "metadata": {
    "title": "공공 AI 플랫폼 구축 추진계획(안)",
    "subtitle": "지방정부 민원·행정 업무에 생성형 AI를 안전하게 도입하기 위한 공통 기반 구축",
    "organization": "○○시 디지털정책관",
    "date": "2026. 10.",
    "audience": "시장·부시장 및 실·국장 (정책 결정 보고)",
    "success_condition": "1단계(2027년) 공통 AI 기반 구축 예산 42억원과 추진체계(TF)를 승인한다",
    "delivery_mode": "pre_read",
    "language": "ko-KR",
    "confidentiality": "내부 검토용"
  },
  "route": { "deck_type": "government_briefing", "style_profile": "government_kr", "brand_mode": "neutral", "communication_mode": "briefing" },
  "evidence": [
    { "id": "E1", "claim": "민원 상담 문의의 48%가 반복 질의(안내·절차·서류)이다", "kind": "fact", "confidence": "high", "source": "○○시 민원콜센터 상담 유형 분석", "period": "2025.1–2025.12" },
    { "id": "E2", "claim": "부서별로 7개의 AI 시범사업이 개별 계약으로 진행 중이며 데이터·보안 기준이 다르다", "kind": "fact", "confidence": "high", "source": "정보화사업 현황 조사", "period": "2026.6" },
    { "id": "E3", "claim": "공통 기반으로 통합하면 연간 운영비를 약 30% 절감할 수 있다", "kind": "estimate", "confidence": "medium", "source": "정보화사업 원가 분석(내부 추정)", "period": "2026.8" }
  ],
  "slides": [
    { "number": 1, "archetype": "cover", "title": "공공 AI 플랫폼 구축 추진계획(안)", "content": { "subtitle": "민원·행정 업무에 생성형 AI를 안전하게 도입하기 위한 공통 기반 구축", "tagline": "정책 결정 보고" } },
    { "number": 2, "archetype": "agenda", "title": "목차", "content": { "items": [ { "label": "추진 배경", "detail": "반복 민원과 분산된 AI 시범사업" }, { "label": "현황 및 문제점", "detail": "7개 사업, 서로 다른 보안·데이터 기준" }, { "label": "추진 방향", "detail": "공통 기반 1개, 부서 서비스는 그 위에" }, { "label": "세부 추진계획", "detail": "3개 과제·3단계" }, { "label": "추진체계·일정·예산", "detail": "TF 구성, 2027–2029, 1단계 42억원" }, { "label": "기대효과 및 건의", "detail": "상담 대기 50% 단축, 운영비 30% 절감" } ] } },
    { "number": 3, "section": "추진 배경", "archetype": "section_divider", "title": "추진 배경", "content": { "subtitle": "왜 지금 공통 AI 기반이 필요한가" } },
    { "number": 4, "section": "추진 배경", "archetype": "hero_metric", "title": "민원 상담의 절반은 반복 질의로, AI 안내로 즉시 응답할 수 있는 영역입니다",
      "content": { "metrics": [ { "value": "48", "unit": "%", "label": "반복 질의(안내·절차·서류) 비율", "delta": "연간 상담 61만 건 중" }, { "value": "7", "unit": "개", "label": "부서별 개별 추진 중인 AI 시범사업", "delta": "계약·보안 기준 상이", "trend": "down" }, { "value": "30", "unit": "%", "label": "공통 기반 통합 시 운영비 절감(추정)", "delta": "연 9.6억원 → 6.7억원", "trend": "up" } ], "context": "반복 질의는 표준 답변으로 처리할 수 있으나 현재는 상담원이 전부 응대하고 있으며, 부서별 AI 사업은 같은 기능(문서 검색·요약·답변 생성)을 중복 구축하고 있습니다." },
      "source_note": "출처: ○○시 민원콜센터 상담 유형 분석(2025년, n=612,340건), 정보화사업 현황 조사(2026.6). 절감률은 내부 원가 분석 추정치", "evidence_ids": ["E1", "E2", "E3"] },
    { "number": 5, "section": "현황 및 문제점", "archetype": "evidence_chart", "title": "반복 질의는 증가 추세이나 상담 인력은 3년째 동결돼 대기시간이 길어지고 있습니다",
      "content": {
        "chart": { "type": "combo", "categories": ["2022", "2023", "2024", "2025"], "series": [ { "name": "반복 질의 건수(천 건)", "kind": "bar", "values": [221, 248, 276, 294] }, { "name": "평균 대기시간(초)", "kind": "line", "secondary": true, "values": [38, 45, 61, 74] } ], "unit": "천 건 / 초" },
        "insight": "상담 인력 동결 상태에서 반복 질의만 3년간 33% 늘어 대기시간이 두 배가 됐습니다",
        "callouts": ["반복 질의 294천 건(2025) = 상담원 14명분 업무량", "대기 74초는 시민 만족도 조사 '불만' 기준(60초) 초과", "야간·주말 문의는 응답률 0%"]
      },
      "source_note": "출처: ○○시 민원콜센터 운영통계(2022–2025). 대기시간은 연평균, 반복 질의는 상담 유형 분류 기준", "evidence_ids": ["E1"] },
    { "number": 6, "section": "현황 및 문제점", "archetype": "comparison", "title": "7개 시범사업이 같은 기능을 따로 구축해 보안·데이터 기준이 제각각입니다",
      "content": {
        "columns": ["현행 (부서별 개별 구축)", "개선 (공통 기반 + 부서 서비스)"],
        "rows": [
          { "criterion": "문서 검색·요약·답변 생성", "cells": ["7개 사업이 각각 구축", "공통 기반 1회 구축 후 공유"] },
          { "criterion": "개인정보·보안 심사", "cells": ["사업별 상이, 2건 미이행", "공통 기준 1회 심사·상시 점검"] },
          { "criterion": "데이터(조례·매뉴얼·FAQ)", "cells": ["부서별 사본, 갱신 불일치", "단일 지식저장소, 부서가 갱신"] },
          { "criterion": "연간 운영비", "cells": ["9.6억원", "6.7억원(추정)"] },
          { "criterion": "신규 서비스 추가 기간", "cells": ["6개월(신규 계약)", "4~6주(기반 위 개발)"] }
        ],
        "winner": 1,
        "verdict": "공통 기반을 먼저 세우고 부서 서비스를 그 위에 얹는 구조로 전환해야 합니다"
      },
      "source_note": "출처: 정보화사업 현황 조사(2026.6), 정보화사업 원가 분석(2026.8, 내부 추정)", "evidence_ids": ["E2", "E3"] },
    { "number": 7, "section": "추진 방향", "archetype": "architecture", "title": "공통 AI 기반은 데이터·모델·보안 3개 층으로 구성하고 부서 서비스는 그 위에서 개발합니다",
      "content": {
        "layers": [
          { "name": "부서 서비스", "tone": "accent", "components": [ { "name": "민원 AI 안내", "note": "콜센터·홈페이지" }, { "name": "행정문서 요약·작성 보조" }, { "name": "조례·규정 검색" }, { "name": "(향후) 부서별 확장" } ] },
          { "name": "공통 AI 기반", "tone": "primary", "components": [ { "name": "지식저장소", "note": "조례·매뉴얼·FAQ" }, { "name": "모델 게이트웨이", "note": "국산·공공 모델 교체 가능" }, { "name": "응답 검증", "note": "출처 표시·금칙어" }, { "name": "이용 통계" } ] },
          { "name": "보안·거버넌스", "components": [ { "name": "개인정보 비식별" }, { "name": "접근 권한·감사 로그" }, { "name": "AI 윤리·품질 심의" } ] },
          { "name": "기존 시스템", "components": [ { "name": "민원 시스템" }, { "name": "전자문서" }, { "name": "홈페이지·콜센터" } ] }
        ],
        "flows": ["부서는 공통 기반의 지식저장소에 자료를 올리고 서비스만 만든다", "모델은 게이트웨이 뒤에 두어 정책·비용에 따라 교체한다", "모든 응답은 출처 표시와 검증을 거쳐 시민에게 전달된다"],
        "legend": "※ 공통 기반은 1단계(2027)에 구축, 부서 서비스는 2단계부터 순차 확대"
      } },
    { "number": 8, "section": "세부 추진계획", "archetype": "points", "title": "3개 과제를 추진하며 1단계는 민원 AI 안내와 공통 기반 구축에 집중합니다",
      "content": { "layout": "rows", "points": [
        { "heading": "과제 1 · 공통 AI 기반 구축", "detail": "지식저장소·모델 게이트웨이·응답 검증·보안 체계를 2027년 상반기까지 구축하고 보안 심사를 완료", "metric": "28억" },
        { "heading": "과제 2 · 민원 AI 안내 서비스", "detail": "반복 질의 상위 200개 유형부터 24시간 AI 안내를 제공하고 상담원 연결은 유지", "metric": "9억" },
        { "heading": "과제 3 · 기존 시범사업 통합", "detail": "7개 사업 중 종료 예정 4개는 공통 기반으로 이관, 3개는 계약 만료 시 전환", "metric": "5억" }
      ] },
      "source_note": "※ 금액은 1단계(2027년) 소요예산, 부가세 포함" },
    { "number": 9, "section": "추진체계·일정·예산", "archetype": "roadmap", "title": "2027년 공통 기반 구축 후 2028–2029년에 부서 서비스로 단계 확대합니다",
      "content": {
        "phases": [
          { "name": "1단계 · 기반 구축", "period": "2027", "items": ["공통 AI 기반 구축·보안 심사", "민원 AI 안내 시범(상위 200개 유형)", "시범사업 4개 이관"], "milestone": "2027.12 민원 AI 안내 정식 개통" },
          { "name": "2단계 · 서비스 확대", "period": "2028", "items": ["행정문서 요약·작성 보조", "조례·규정 검색", "부서 서비스 5개 추가"], "milestone": "2028.6 전 부서 공통 기반 사용" },
          { "name": "3단계 · 고도화", "period": "2029", "items": ["다국어 민원 안내", "음성 상담 연계", "성과 평가·모델 교체"], "milestone": "2029.12 운영비 30% 절감 달성" }
        ],
        "horizon": "2027 – 2029"
      } },
    { "number": 10, "section": "추진체계·일정·예산", "archetype": "pricing_or_budget", "title": "1단계 소요예산은 42억원이며 공통 기반 구축이 67%를 차지합니다",
      "content": {
        "unit": "억원",
        "items": [ { "label": "공통 AI 기반 구축(과제 1)", "amount": "28.0", "note": "SW 개발·클라우드·보안 심사" }, { "label": "민원 AI 안내 서비스(과제 2)", "amount": "9.0", "note": "지식 구축·콜센터 연계" }, { "label": "시범사업 통합(과제 3)", "amount": "5.0", "note": "데이터 이관·계약 정리" } ],
        "total": "42.0",
        "assumptions": ["국비 공모(행안부 AI 행정 지원) 선정 시 50% 국비 매칭 가능", "클라우드는 공공 클라우드 이용 단가 기준", "운영비는 2028년부터 연 6.7억원(추정)"],
        "exclusions": ["부서 서비스 2·3단계 개발비", "콜센터 인력 조정"]
      },
      "source_note": "출처: 정보화사업 원가 분석(2026.8). 부가세 포함, 국비 매칭은 공모 선정 전제" },
    { "number": 11, "section": "추진체계·일정·예산", "archetype": "process", "title": "디지털정책관 주관 TF가 기반을 구축하고 부서는 서비스 책임을 집니다",
      "content": { "style": "numbered", "steps": [
        { "title": "AI 추진 TF 구성", "detail": "디지털정책관(단장), 민원·정보보안·법무 부서 참여", "owner": "디지털정책관" },
        { "title": "공통 기준 제정", "detail": "데이터·보안·윤리 심의 기준과 서비스 등록 절차", "owner": "TF · 정보보안담당관" },
        { "title": "기반 구축·심사", "detail": "공통 기반 구축 후 개인정보영향평가·보안성 검토", "owner": "디지털정책관" },
        { "title": "부서 서비스 등록", "detail": "부서가 지식·서비스를 등록하고 TF가 품질 심의", "owner": "각 실·국" }
      ] } },
    { "number": 12, "section": "기대효과 및 건의", "archetype": "recommendation", "title": "1단계 예산 42억원과 TF 구성을 승인해 주시면 2027년 말 민원 AI 안내를 개통하겠습니다",
      "content": {
        "recommendation": "2027년 공통 AI 기반 구축 예산 42억원(국비 매칭 시 시비 21억원)과 디지털정책관 주관 AI 추진 TF 구성을 건의드립니다",
        "reasons": [ { "heading": "시민 체감", "detail": "반복 질의 24시간 즉시 응답으로 상담 대기 50% 단축 목표" }, { "heading": "재정 효율", "detail": "중복 구축 해소로 연간 운영비 약 30%(2.9억원) 절감 추정" }, { "heading": "안전한 도입", "detail": "공통 보안·윤리 기준으로 부서별 미이행 위험 제거" } ],
        "next_action": "승인 후 11월 TF 구성, 12월 국비 공모 신청, 2027년 1월 공통 기반 사업 발주",
        "owner": "디지털정책관", "timing": "2026.11"
      } },
    { "number": 13, "archetype": "appendix", "title": "참고 1. 부서별 AI 시범사업 현황(2026.6 기준)", "appendix": true,
      "content": { "table": { "columns": ["사업명", "주관 부서", "계약 기간", "연 비용(억원)", "보안 심사", "처리 방안"], "rows": [ ["민원 챗봇", "민원과", "~2026.12", "1.8", "완료", "1단계 이관"], ["문서 요약 보조", "총무과", "~2027.3", "1.2", "완료", "1단계 이관"], ["조례 검색", "법무담당관", "~2026.12", "0.9", "미이행", "1단계 이관"], ["관광 안내 챗봇", "관광과", "~2027.6", "1.5", "완료", "계약 만료 시 전환"], ["복지 상담 보조", "복지정책과", "~2026.12", "1.6", "미이행", "1단계 이관"], ["교통 민원 분류", "교통과", "~2027.9", "1.4", "완료", "계약 만료 시 전환"], ["보도자료 초안", "홍보담당관", "~2027.12", "1.2", "완료", "계약 만료 시 전환"] ] }, "items": ["연 비용 합계 9.6억원(부가세 포함)", "보안 심사 = 개인정보영향평가·보안성 검토 이행 여부"] },
      "source_note": "출처: 정보화사업 현황 조사(2026.6)" }
  ]
}
